2011;12;4;;BCD;13:40N;049:56E;Product Tanker;Panama;Steaming;Fired upon;6;6;;0;0;0;0;0;1;1218 UTC Steaming Fired upon Saint Ram Product Tanker Panama 24248 9037056 13:40N __ 049:56E, Gulf of Aden Six pirates armed with RPG and guns in a skiff chased and fired upon the tanker underway with intent to hijack. Master raised alarm. Armed security team onboard the tanker exchanged fire with the skiff resulting in the skiff moving away.;13.6666666667;49.9333333333;7.0;1218 utc steaming fired upon saint ram product tanker panama 24248 9037056 13:40n __ 049:56e, gulf of aden six pirates armed with rpg and guns in a skiff chased and fired upon the tanker underway with intent to hijack. master raised alarm. armed security team onboard the tanker exchanged fire with the skiff resulting in the skiff moving away.;1;0;549.978463779;122.884078556;5.0;17.0;G;249.658271032
2011;12;4;;BCD;14:22N;042:36E;Bulk Carrier;Vietnam;Steaming;Attempted;5;5;;0;0;0;0;0;0;0430 UTC Steaming Attempted Vinaship Pearl Bulk Carrier Vietnam 14602 9114488 14:22N __ 042:36E, Red Sea About five pirates in a skiff approached the ship underway. All crew went into the citadel while bridge team increased speed, took evasive manoeuvres, enforced anti piracy measures and contacted authorities. The skiff aborted the attempt to board.;14.3666666667;42.6;7.0;0430 utc steaming attempted vinaship pearl bulk carrier vietnam 14602 9114488 14:22n __ 042:36e, red sea about five pirates in a skiff approached the ship underway. all crew went into the citadel while bridge team increased speed, took evasive manoeuvres, enforced anti piracy measures and contacted authorities. the skiff aborted the attempt to board.;0;0;62.8970887289;42.3985017974;6.0;4.0;G;790.178401733
2011;22;4;;BCD;14:02N;042:51E;Container;Malta;Steaming;Attempted;-1;-1;;0;0;0;0;0;0;0600 UTC Steaming Attempted MSC Dymphna Container Malta 36420 8608195 14:02N __ 042:51E (Around 6 NM of Jabal Zuqar Islands, Yemen), Red Sea Duty lookout onboard the ship underway noticed 16 pirates in four white skiffs at a distance of 3nm approaching the ship at 20 knots. Master noticed the skiffs carrying ladders and weapons and gave order for lockdown procedures. Master raised alarm, increased speed, sounded ship's horn, and informed ships in the vicinity and fired a warning flare towards the skiffs. The skiffs ignored the warning and continued to chase the ship and closed to a distance of 300 metres. Another flare was fired into the water next to the closest skiff. The skiffs closed in to a distance of 180 metres before aborting the attack after one hour of chasing. Authorities informed.;14.0333333333;42.85;8.0;0600 utc steaming attempted msc dymphna container malta 36420 8608195 14:02n __ 042:51e (around 6 nm of jabal zuqar islands, yemen), red sea duty lookout onboard the ship underway noticed 16 pirates in four white skiffs at a distance of 3nm approaching the ship at 20 knots. master noticed the skiffs carrying ladders and weapons and gave order for lockdown procedures. master raised alarm, increased speed, sounded ship's horn, and informed ships in the vicinity and fired a warning flare towards the skiffs. the skiffs ignored the warning and continued to chase the ship and closed to a distance of 300 metres. another flare was fired into the water next to the closest skiff. the skiffs closed in to a distance of 180 metres before aborting the attack after one hour of chasing. authorities informed.;0;0;88.9695692695;26.9986923575;6.0;5.0;G;750.519996109
2011;22;4;;BCD;15:11.03N;051:36.36E;Product Tanker;Yemen;Steaming;Fired upon;-1;-1;;0;0;0;0;0;0;2250 UTC Steaming Fired upon Rudeef Gna Product Tanker Yemen 2467 9002362 15:11.03N __ 051:36.36E, Gulf of Aden Pirates in a skiff armed with guns approached the tanker underway. At a distance of around 5-10 metres they opened fired upon the tanker. Onboard security team retaliated and the pirates aborted the attack after five minutes of exchanging fire. No injuries to crew and the tanker continued her voyage. Authorities informed.;15.1841666667;51.61;8.0;2250 utc steaming fired upon rudeef gna product tanker yemen 2467 9002362 15:11.03n __ 051:36.36e, gulf of aden pirates in a skiff armed with guns approached the tanker underway. at a distance of around 5-10 metres they opened fired upon the tanker. onboard security team retaliated and the pirates aborted the attack after five minutes of exchanging fire. no injuries to crew and the tanker continued her voyage. authorities informed.;1;0;323.245523968;16.1179920693;8.0;20.0;G;374.596097666
2011;3;5;;BCD;13:10.9N;049:18.8E;Bulk Carrier;Denmark;Steaming;Attempted;-1;-1;;0;0;0;0;0;0;0310 UTC Steaming Attempted  Nord Neptune Bulk Carrier Denmark 38892 9310537 13:10.9N __ 049:18.8E, Gulf of Aden Watch keepers and armed security team onboard the ship underway noticed a green and red hulled skiff with nine persons onboard at a distance of 3-4nm. The skiff was seen approaching the ship at a speed of approximately 18 knots. Weapons were sighted by the crew onboard the ship. The armed security fired warning flare over the skiff. However, the skiff continued to approach the ship. When the skiff was approximately 400 meters from the ship the armed team fired five warning shots in front of the skiff resulting in the skiff moving away. UKMTO and warships in the vicinity informed.;13.1691666667;49.3022222222;9.0;0310 utc steaming attempted  nord neptune bulk carrier denmark 38892 9310537 13:10.9n __ 049:18.8e, gulf of aden watch keepers and armed security team onboard the ship underway noticed a green and red hulled skiff with nine persons onboard at a distance of 3-4nm. the skiff was seen approaching the ship at a speed of approximately 18 knots. weapons were sighted by the crew onboard the ship. the armed security fired warning flare over the skiff. however, the skiff continued to approach the ship. when the skiff was approximately 400 meters from the ship the armed team fired five warning shots in front of the skiff resulting in the skiff moving away. ukmto and warships in the vicinity informed.;0;0;475.566228003;117.674807281;4.0;16.0;G;209.139501212
2011;13;5;;BCD;13:10.7N;048:37.0E;Container;USA;Steaming;Attempted;5;5;;0;0;0;0;0;0;2110 UTC Steaming Attempted Maersk Alabama Container USA 14120 9164263 13:10.7N __ 048:37.0E, Gulf of Aden A small fast contact was noticed on radar approaching the ship underway at 4nm. D/O monitored the contact and at a distance of 1.6nm it was observed as a skiff and alarm was raised. When the skiff approached at a distance of 50 metres, the bridge team noticed five pirates onboard with a hook ladder. The onboard security team fired two shots into the skiff when the skiff close in to 30 metres resulting in the pirates aborted the attempted attack. Authorities informed.;13.1686111111;48.6166666667;9.0;2110 utc steaming attempted maersk alabama container usa 14120 9164263 13:10.7n __ 048:37.0e, gulf of aden a small fast contact was noticed on radar approaching the ship underway at 4nm. d/o monitored the contact and at a distance of 1.6nm it was observed as a skiff and alarm was raised. when the skiff approached at a distance of 50 metres, the bridge team noticed five pirates onboard with a hook ladder. the onboard security team fired two shots into the skiff when the skiff close in to 30 metres resulting in the pirates aborted the attempted attack. authorities informed.;0;0;401.485526969;93.2847422339;4.0;15.0;G;216.973132634
2011;20;5;;BCD;13:15N;043:01E;Bulk Carrier;Marshall Islands;Steaming;Fired upon;-1;-1;;0;0;0;0;0;0;0633 UTC Steaming Fired upon Cape Spencer Bulk Carrier Marshall Islands 89441 9461269 13:15N __ 043:01E, (Around 20 NM NE of Assab, Eritrea), Red Sea Pirates in two skiffs chased and fired upon the ship underway. Master enforced effective anti-piracy measures including evasive manoeuvres and managed to repel the attack. All crew safe.;13.25;43.0166666667;10.0;0633 utc steaming fired upon cape spencer bulk carrier marshall islands 89441 9461269 13:15n __ 043:01e, (around 20 nm ne of assab, eritrea), red sea pirates in two skiffs chased and fired upon the ship underway. master enforced effective anti-piracy measures including evasive manoeuvres and managed to repel the attack. all crew safe.;0;0;175.410662593;23.1913469863;5.0;5.0;G;703.519299752
2011;22;5;;BCD;14:31N;042:13E;Chemical Tanker;Panama;Steaming;Fired upon;-1;-1;;0;0;0;0;0;0;0617 UTC Steaming Fired upon Golden Yosa Chemical Tanker Panama 11645 9407081 14:31N __ 042:13E (Around 45 NM WxS of Al Hudaydah, Yemen), Red Sea A mother vessel was seen launching a skiff which chased and fired upon the tanker underway. Master enforced anti-piracy measures and the ship_s security team onboard returned fire resulting in the pirates aborting the attack and moving away.  The ship and the crew are safe.;14.5166666667;42.2166666667;10.0;0617 utc steaming fired upon golden yosa chemical tanker panama 11645 9407081 14:31n __ 042:13e (around 45 nm wxs of al hudaydah, yemen), red sea a mother vessel was seen launching a skiff which chased and fired upon the tanker underway. master enforced anti-piracy measures and the ship_s security team onboard returned fire resulting in the pirates aborting the attack and moving away.  the ship and the crew are safe.;0;0;84.7725564303;78.2626348878;7.0;4.0;G;834.665076311
2011;25;5;;BCD;12:33N;043:26E;Tanker;Isle of Man;Steaming;Attempted;-1;-1;;0;0;0;0;0;0;1510 UTC Steaming Attempted British Hazel Tanker Isle of Man 58070 9266853 12:33N __ 043:26E, Bab El Mandeb, Red Sea Pirates in five skiffs chased the tanker underway. Master raised alarm and took evasive measures. Weapons and ladders were sighted by the unarmed security team on the skiffs. Authorities contacted for assistance and a warship in the area came and dispersed the skiffs.;12.55;43.4333333333;10.0;1510 utc steaming attempted british hazel tanker isle of man 58070 9266853 12:33n __ 043:26e, bab el mandeb, red sea pirates in five skiffs chased the tanker underway. master raised alarm and took evasive measures. weapons and ladders were sighted by the unarmed security team on the skiffs. authorities contacted for assistance and a warship in the area came and dispersed the skiffs.;0;0;110.602264871;14.2535971123;4.0;6.0;G;640.06649899
2011;25;5;;BCD;12:37.2N;043:19.2E;Container;Marshall Islands;Steaming;Attempted;-1;-1;;0;0;0;0;0;0;1520 UTC Steaming Attempted Hanjin Milano Container  Marshall Islands 40542 9431680 12:37.2N __ 043:19.2E, Bab El Mandeb,  Red Sea Pirates in two skiffs chased the ship underway. Master raised alarm, increased speed, took evasive manoeuvres, contacted warship and authorities for assistance. The skiffs chased and closed in at a distance of 0.5 nm before aborting the attempted attack.;12.6172222222;43.3172222222;10.0;1520 utc steaming attempted hanjin milano container  marshall islands 40542 9431680 12:37.2n __ 043:19.2e, bab el mandeb,  red sea pirates in two skiffs chased the ship underway. master raised alarm, increased speed, took evasive manoeuvres, contacted warship and authorities for assistance. the skiffs chased and closed in at a distance of 0.5 nm before aborting the attempted attack.;0;0;114.62662586;11.7117003284;4.0;6.0;G;653.972701822
2011;25;5;;BCD;13:12.7N;048:58.4E;Tanker;Malta;Steaming;Fired upon;7;7;;0;0;0;0;0;0;1535 LT Steaming Fired upon Damavand Tanker Malta 160576 9218478 13:12.7N __ 048:58.4E, Gulf of Aden One speed boat with seven pirates armed with guns chased and fired upon the tanker underway.  Master enforced anti-piracy measures and requested assistance from warship. An Iranian warship in the vicinity responded resulting in the skiff aborting and moving away.;13.2019444444;48.9677777778;10.0;1535 lt steaming fired upon damavand tanker malta 160576 9218478 13:12.7n __ 048:58.4e, gulf of aden one speed boat with seven pirates armed with guns chased and fired upon the tanker underway.  master enforced anti-piracy measures and requested assistance from warship. an iranian warship in the vicinity responded resulting in the skiff aborting and moving away.;1;0;439.724543878;98.2705512563;5.0;16.0;G;213.345256141
2011;29;5;;BCD;14:24N;042:04E;Bulk Carrier;Marshall Islands;Steaming;Fired upon;-1;-1;;0;0;0;0;0;0;1150 UTC Steaming Fired upon Hawk I Bulk Carrier Marshall Islands 27986 9224661 14:24N __ 042:04E Red Sea Two skiffs chased and fired upon a bulk carrier underway. The vessel sent SSAS alert, raised alarm and crew mustered in citadel. The security team onboard enforced anti piracy measures resulting in the pirates aborting the attack.;14.4;42.0666666667;10.0;1150 utc steaming fired upon hawk i bulk carrier marshall islands 27986 9224661 14:24n __ 042:04e red sea two skiffs chased and fired upon a bulk carrier underway. the vessel sent ssas alert, raised alarm and crew mustered in citadel. the security team onboard enforced anti piracy measures resulting in the pirates aborting the attack.;0;0;104.964537608;59.6470669876;6.0;3.0;G;844.214231701
2011;31;5;;BCD;13:35N;042:37E;Chemical Tanker;Singapore;Steaming;Attempted;6;6;;0;0;0;0;0;0;0437 UTC Steaming Attempted Astir Lady Chemical Tanker Singapore 30043 9457385 13:35N __ 042:37E, Red Sea Six pirates in one skiff chased the tanker underway with intend to hijack her. The tanker took all anti-piracy preventive measures resulting in the pirates aborting the attempt.;13.5833333333;42.6166666667;10.0;0437 utc steaming attempted astir lady chemical tanker singapore 30043 9457385 13:35n __ 042:37e, red sea six pirates in one skiff chased the tanker underway with intend to hijack her. the tanker took all anti-piracy preventive measures resulting in the pirates aborting the attempt.;0;0;142.462335489;33.7759939862;5.0;4.0;G;756.173047462
2011;6;6;;BCD;14:10N;042:19E;Bulk Carrier;Liberia;Steaming;Attempted;-1;-1;;0;0;0;0;0;0;1200 UTC Steaming Attempted Emperor Bulk Carrier Liberia 22064 8315009 14:10N __ 042:19E,  Red Sea Pirates in two skiffs chased the ship underway with intend to hijack her. The ship increased speed, made evasive manoeuvres and deployed the onboard armed team. Crew went into citadel and informed authorities.  Later the skiffs stopped and moved away.;14.1666666667;42.3166666667;11.0;1200 utc steaming attempted emperor bulk carrier liberia 22064 8315009 14:10n __ 042:19e,  red sea pirates in two skiffs chased the ship underway with intend to hijack her. the ship increased speed, made evasive manoeuvres and deployed the onboard armed team. crew went into citadel and informed authorities.  later the skiffs stopped and moved away.;0;1;99.296061057;51.1863217291;6.0;4.0;G;809.328997682
2011;7;6;;BCD;13:33.3N;050:27.4E;Bulk Carrier;Panama;Steaming;Fired upon;7;7;;0;0;0;0;0;0;1315 UTC Steaming Fired upon Achilleas Bulk Carrier Panama 22953 8308070 13:33.3N __ 050:27.4E,  Gulf of Aden About seven pirates in a skiff chased and fired upon the ship underway. Master raised alarm, crew mustered in citadel and deployed security team on bridge who fired warning shots. A naval helicopter arrived at location. The pirates aborted the attempted attack. Crew and ship are safe.;13.5508333333;50.4511111111;11.0;1315 utc steaming fired upon achilleas bulk carrier panama 22953 8308070 13:33.3n __ 050:27.4e,  gulf of aden about seven pirates in a skiff chased and fired upon the ship underway. master raised alarm, crew mustered in citadel and deployed security team on bridge who fired warning shots. a naval helicopter arrived at location. the pirates aborted the attempted attack. crew and ship are safe.;0;1;536.770396627;146.165654205;5.0;18.0;G;210.558095485
2011;10;6;;BCD;13:29N;042:37E;Bulk Carrier;China;Steaming;Fired upon;6;6;;0;0;0;0;0;0;1135 UTC Steaming Fired upon Tai Shun Hai Bulk Carrier China 27958 8919568 13:29N __ 042:37E (Around 30 NM North of Assab, Eritrea), Red Sea Six pirates in one skiff chased and fired upon the ship underway. Master took all anti piracy preventative measures and contacted the coalition forces resulting in the pirates aborting the attempt.;13.4833333333;42.6166666667;11.0;1135 utc steaming fired upon tai shun hai bulk carrier china 27958 8919568 13:29n __ 042:37e (around 30 nm north of assab, eritrea), red sea six pirates in one skiff chased and fired upon the ship underway. master took all anti piracy preventative measures and contacted the coalition forces resulting in the pirates aborting the attempt.;0;1;153.227356455;28.9956109386;5.0;4.0;G;752.655620661
2011;11;6;;BCD;13:42.1N;042:35.8E;Tanker;Liberia;Steaming;Attempted;5;5;;0;0;0;0;0;0;0420 UTC Steaming Attempted Nautic Tanker Liberia 78845 9150377  13:42.1N __ 042:35.8E (Around 40 NM North of Assab, Eritrea), Red Sea Five pirates in a skiff chased the tanker underway. Small arms and ladder observed in the skiff. All crew except Master and OOW were mustered at safe point. Security guard onboard fired warning shots and pirates moved away.;13.7002777778;42.5855555556;11.0;0420 utc steaming attempted nautic tanker liberia 78845 9150377  13:42.1n __ 042:35.8e (around 40 nm north of assab, eritrea), red sea five pirates in a skiff chased the tanker underway. small arms and ladder observed in the skiff. all crew except master and oow were mustered at safe point. security guard onboard fired warning shots and pirates moved away.;0;1;130.859667099;35.3190844494;5.0;4.0;G;763.63552521
2011;11;6;;BCD;13:29N;042:43E;Tanker;Hong Kong;Steaming;Attempted;7;7;;0;0;0;0;0;0;0419 UTC Steaming Attempted Everbright Tanker Hong Kong 83805 9408217 13:29N __ 042:43E, Red Sea While underway the D/O onboard the tanker spotted a skiff on radar. When the skiff approached closer, seven pirates were observed in the skiff. Weapons and ladders were sighted. The pirates could not board the tanker due to high freeboard. Later the skiff moved away.;13.4833333333;42.7166666667;11.0;0419 utc steaming attempted everbright tanker hong kong 83805 9408217 13:29n __ 042:43e, red sea while underway the d/o onboard the tanker spotted a skiff on radar. when the skiff approached closer, seven pirates were observed in the skiff. weapons and ladders were sighted. the pirates could not board the tanker due to high freeboard. later the skiff moved away.;0;1;151.185456155;33.369158936;5.0;4.0;G;742.375010456
2011;11;6;;BCD;13:34.9N;042:37.4E;Chemical Tanker;Norway;Steaming;Fired upon;5;5;;0;0;0;0;0;0;0425 UTC Steaming Fired upon Emma Victory Chemical Tanker Norway 26218 9105085 13:34.9N __ 042:37.4E (Around 30 NM North of Assab, Eritrea), Red Sea Master onboard the tanker underway was warned by vessel ahead that there were skiffs in the area. Later Master saw one skiff approaching his tanker at high speed. The skiff fired towards the tanker and managed to come alongside. Master noticed five pirates in the skiff attempting to place the boarding ladder on the tanker. At this time the Master also noticed another two skiffs approaching. Aggressive manoeuvring by the Master resulted in the pirates aborting and moving away.;13.5691666667;42.6177777778;11.0;0425 utc steaming fired upon emma victory chemical tanker norway 26218 9105085 13:34.9n __ 042:37.4e (around 30 nm north of assab, eritrea), red sea master onboard the tanker underway was warned by vessel ahead that there were skiffs in the area. later master saw one skiff approaching his tanker at high speed. the skiff fired towards the tanker and managed to come alongside. master noticed five pirates in the skiff attempting to place the boarding ladder on the tanker. at this time the master also noticed another two skiffs approaching. aggressive manoeuvring by the master resulted in the pirates aborting and moving away.;0;1;143.956212102;33.1600925314;5.0;4.0;G;755.552106378
2011;16;6;;BCD;13:43.8N;042:56.8E;General Cargo;Gibraltar;Steaming;Attempted;5;5;;0;0;0;0;0;0;0800 UTC Steaming Attempted Anna General Cargo Gibraltar 5044 9566796 13:43.8N __ 042:56.8E (Around 42 NM NxE of Assab, Eritrea), Red Sea A skiff with five pirates approached the ship underway at a speed of 25 knots. As the skiff closed in, a pirate with a gun was observed. When the skiff closed in to 100 meters the onboard armed security team fired warning shots resulting in the skiff moving away.;13.7188888889;42.9355555556;12.0;0800 utc steaming attempted anna general cargo gibraltar 5044 9566796 13:43.8n __ 042:56.8e (around 42 nm nxe of assab, eritrea), red sea a skiff with five pirates approached the ship underway at a speed of 25 knots. as the skiff closed in, a pirate with a gun was observed. when the skiff closed in to 100 meters the onboard armed security team fired warning shots resulting in the skiff moving away.;1;1;123.304439063;34.1056559618;5.0;5.0;G;728.861169815
2011;29;6;;BCD;13:17N;042:59E;Chemical Tanker;Marshall Islands;Steaming;Attempted;6;6;;0;0;0;0;0;0;"1530 UTC Steaming Attempted Omega DukeChemical Tanker Marshall Islands 29130 9470909 13:17N __042:59E, Red Sea Two skiffs with six pirates in eachapproached a tanker underway. Master raised alarm; crew alerted and commenced evasive manoeuvres. At a distance of 100 meters a ladder and weapons were sighted. Onboard security team fired warning shots and the pirates aborted the attack.";13.2833333333;42.9833333333;12.0;"1530 utc steaming attempted omega dukechemical tanker marshall islands 29130 9470909 13:17n __042:59e, red sea two skiffs with six pirates in eachapproached a tanker underway. master raised alarm; crew alerted and commenced evasive manoeuvres. at a distance of 100 meters a ladder and weapons were sighted. onboard security team fired warning shots and the pirates aborted the attack.";0;1;171.576821795;26.4980610964;5.0;5.0;G;708.070595591
2011;13;7;;BCD;12:44N;043:18E;Chemical Tanker;Panama;Steaming;Attempted;-1;-1;;0;0;0;0;0;0;0717 UTC Steaming Attempted North Fighter Chemical Tanker Panama 11662 9352597 12:44N __ 043:18E, Red Sea Pirates armed with guns in two skiffs chased and approached the tanker underway. Master mustered crew and ship_s security team was deployed to the bridge wings. On sighting the security team, the pirates aborted the attack and moved away.;12.7333333333;43.3;13.0;0717 utc steaming attempted north fighter chemical tanker panama 11662 9352597 12:44n __ 043:18e, red sea pirates armed with guns in two skiffs chased and approached the tanker underway. master mustered crew and ship_s security team was deployed to the bridge wings. on sighting the security team, the pirates aborted the attack and moved away.;1;1;126.95124609;17.3284954663;4.0;5.0;G;658.673915483
2011;16;7;;BCD;13:36.3N;050:17.3E;Bulk Carrier;Panama;Steaming;Attempted;6;6;;0;0;0;0;0;1;0340 UTC Steaming Attempted Elinakos Bulk Carrier Panama 38364 9159555 13:36.3N __ 050:17.3E, Gulf of Aden Six pirates in a skiff chased the ship underway. Master raised alarm, crew proceeded to citadel and security guards on board fired a hand flare. The pirates continued to chase the ship and closed to a distance of 300 metres from the ship. The security guards fired a warning shot upon sighting guns, RPG and ladder's on the skiff. The pirates aborted the attempted attack and moved away. Incident reported to the warship.;13.6008333333;50.2841666667;14.0;0340 utc steaming attempted elinakos bulk carrier panama 38364 9159555 13:36.3n __ 050:17.3e, gulf of aden six pirates in a skiff chased the ship underway. master raised alarm, crew proceeded to citadel and security guards on board fired a hand flare. the pirates continued to chase the ship and closed to a distance of 300 metres from the ship. the security guards fired a warning shot upon sighting guns, rpg and ladder's on the skiff. the pirates aborted the attempted attack and moved away. incident reported to the warship.;1;1;545.902640466;137.792947329;5.0;18.0;G;223.520113584
2011;18;7;;BCD;14:36.1N;042:19.1E;LPG Tanker;Singapore;Steaming;Attempted;-1;-1;;0;0;0;0;0;0;0710 UTC Steaming Attempted Stella Kosan LPG Tanker Singapore 9175 9373591 14:36.1N __ 042:19.1E (Around 38 NM WSW of Al Hudaydah, Yemen), Red Sea Nine skiffs followed the tanker underway and then surrounded her. One skiff with six men suddenly turned towards the tanker. Master took evasive manoeuvres and when the skiff closed to 50-60 metres fuel cans and weapons were sighted. The security team onboard the tanker fired a flare towards the skiff, which was ignored by the skiff. The security team then fired two warning shots which resulted in the skiffs moving away.;14.6002777778;42.3169444444;14.0;0710 utc steaming attempted stella kosan lpg tanker singapore 9175 9373591 14:36.1n __ 042:19.1e (around 38 nm wsw of al hudaydah, yemen), red sea nine skiffs followed the tanker underway and then surrounded her. one skiff with six men suddenly turned towards the tanker. master took evasive manoeuvres and when the skiff closed to 50-60 metres fuel cans and weapons were sighted. the security team onboard the tanker fired a flare towards the skiff, which was ignored by the skiff. the security team then fired two warning shots which resulted in the skiffs moving away.;0;1;71.2120941276;67.1267386798;7.0;4.0;G;828.785104677
