2008;1;4;;BCD;13:45.81N;049:18.79E;Chemical Tanker;Panama;Steaming;Fired upon;-1;-1;;0;0;0;0;0;1;0915 LT Steaming Fired upon Sunshine Sky Chemical Tanker Panama 9488 9146027 13:45.81N __ 049:18.79E, Gulf of Aden Three speed boats chased and attacked the tanker underway with automatic weapons and rocket launchers. Master took evasive manoeuvres and increased speed.  Later, boats moved away.  Ship_s funnel and lifeboat were damaged by gunfire/RPG. An hour later, five speedboats chased the tanker again from various directions.  Tanker took evasive manoeuvres and prevented the boats from closing in.  Later the boats moved away.  The IMB Piracy Reporting Centre communicated with the coalition Navy, the owners and Master of Tanker to provide assistance as required. One coalition warship was in the vicinity monitoring the five speed boats.;13.7725;49.3219444444;7.0;0915 lt steaming fired upon sunshine sky chemical tanker panama 9488 9146027 13:45.81n __ 049:18.79e, gulf of aden three speed boats chased and attacked the tanker underway with automatic weapons and rocket launchers. master took evasive manoeuvres and increased speed.  later, boats moved away.  ship_s funnel and lifeboat were damaged by gunfire/rpg. an hour later, five speedboats chased the tanker again from various directions.  tanker took evasive manoeuvres and prevented the boats from closing in.  later the boats moved away.  the imb piracy reporting centre communicated with the coalition navy, the owners and master of tanker to provide assistance as required. one coalition warship was in the vicinity monitoring the five speed boats.;1;0;487.133292099;68.8622735095;5.0;16.0;G;275.88487531
2008;21;4;;BCD;13:00.3N;049:07.4E;Tanker;Japan;Steaming;Fired upon;-1;-1;;0;0;0;0;0;1;0110 UTC Steaming Fired upon Takayama Tanker Japan 150053 9052343 13:00.3N __ 049:07.4E, Gulf of Aden Five speed boats chased and opened fire on the tanker underway, in ballast. Tanker increased speed and enforced anti piracy preventive measures. Speed boats aborted the attack after 30 minutes and disappeared. Some damage to hull possibly due to RPG fire.  No injuries to crew.;13.0008333333;49.1177777778;8.0;0110 utc steaming fired upon takayama tanker japan 150053 9052343 13:00.3n __ 049:07.4e, gulf of aden five speed boats chased and opened fire on the tanker underway, in ballast. tanker increased speed and enforced anti piracy preventive measures. speed boats aborted the attack after 30 minutes and disappeared. some damage to hull possibly due to rpg fire.  no injuries to crew.;0;0;454.56527841;124.81216771;4.0;16.0;G;190.070350828
2008;28;4;;BCD;12:38.8N;049:46.9E;Bulk Carrier;South Korea;Steaming;Fired upon;-1;-1;;0;0;0;0;0;1;0940 UTC Steaming Fired upon Alexander Carl Bulk Carrier South Korea 110627 9039169 12:38.8N __ 049:46.9E, 90 NM Off Bosasso, North Coast of Somalia, Gulf of Aden Pirates in two speedboats, fired upon the ship underway using machine guns and RPG in an attempt to board the ship. The Master increased speed and carried out evasive manoeuvres. Due to the actions of the master and the high freeboard, the pirates were unable to board the ship. The IMB Piracy Reporting Centre informed the coalition forces. A military aircraft  was dispatched. The boats moved away.;12.6355555556;49.7691666667;8.0;0940 utc steaming fired upon alexander carl bulk carrier south korea 110627 9039169 12:38.8n __ 049:46.9e, 90 nm off bosasso, north coast of somalia, gulf of aden pirates in two speedboats, fired upon the ship underway using machine guns and rpg in an attempt to board the ship. the master increased speed and carried out evasive manoeuvres. due to the actions of the master and the high freeboard, the pirates were unable to board the ship. the imb piracy reporting centre informed the coalition forces. a military aircraft  was dispatched. the boats moved away.;1;0;525.557760808;119.605855384;4.0;17.0;G;163.346480918
2008;28;4;;BCD;14:15.5N;050:11.8E;General Cargo;Philippines;Steaming;Attempted;-1;-1;;0;0;0;0;0;0;2203 LT Steaming Attempted Navajo Princess General Cargo Philippines 22053 8613413 14:15.5N __ 050:11.8E,  35 NM Off Yemen Coast, Gulf of Aden A ship underway observed on radar three speedboats approaching at high speed. Alarm raised and anti piracy measures activated. All accommodation lights and navigations lights switched off. The boats continued to follow and slowly close onto the ship. Finally, to deter the pirates the chief officer threw wooden pallets and old garbage drums overboard in the path of the boats. This caused the boats to suddenly stop and abort the chase.;14.2513888889;50.1855555556;8.0;2203 lt steaming attempted navajo princess general cargo philippines 22053 8613413 14:15.5n __ 050:11.8e,  35 nm off yemen coast, gulf of aden a ship underway observed on radar three speedboats approaching at high speed. alarm raised and anti piracy measures activated. all accommodation lights and navigations lights switched off. the boats continued to follow and slowly close onto the ship. finally, to deter the pirates the chief officer threw wooden pallets and old garbage drums overboard in the path of the boats. this caused the boats to suddenly stop and abort the chase.;0;0;507.875676369;65.2854020974;6.0;18.0;G;293.054864903
2008;19;5;;BCD;12:49.3N;050:36.3E;Container;Panama;Steaming;Attempted;4;4;;0;0;0;0;0;1;1500 LT Steaming Attempted River Elegance Container Panama 48161 9072147 12:49.3N __ 050:36.3E, 55 NM Off Somalia Coast, Gulf of Aden Two small speedboats approached the ship underway from the bow. One of the speedboats had four pirates armed with automatic weapons and rocket launcher. The pirates aimed the rocket launcher towards the bridge and tried to board the ship.  Master raised alarm, took evasive manoeuvres and crew mustered. After 10 minutes, the pirates aborted the attempt and were seen approaching two other ships about five miles off.;12.8175;50.6008333333;10.0;1500 lt steaming attempted river elegance container panama 48161 9072147 12:49.3n __ 050:36.3e, 55 nm off somalia coast, gulf of aden two small speedboats approached the ship underway from the bow. one of the speedboats had four pirates armed with automatic weapons and rocket launcher. the pirates aimed the rocket launcher towards the bridge and tried to board the ship.  master raised alarm, took evasive manoeuvres and crew mustered. after 10 minutes, the pirates aborted the attempt and were seen approaching two other ships about five miles off.;1;0;586.614156288;93.8262339603;4.0;19.0;G;131.31719863
2008;23;5;;BCD;13:16.2N;049:08.7E;Bulk Carrier;United Kingdom;Steaming;Fired upon;4;4;;0;0;0;0;0;1;0430 UTC Steaming Fired upon Cape Merlin Bulk Carrier United Kingdom 77503 9056818 13:16.2N __ 049:08.7E, Gulf of Aden Four pirates armed with automatic guns and rocket launchers in a grey coloured, long speed boat approached the ship underway from the port quarter. They fired at the bridge and accommodation. Master raised alarm, increased speed, took evasive manoeuvres and crew mustered. OOW informed ships in vicinity via VHF Ch. 16. The pirates tried to board the ship without success and finally aborted the attempt. One, white hull fishing boat, was noticed about six nm off.;13.2672222222;49.1352777778;10.0;0430 utc steaming fired upon cape merlin bulk carrier united kingdom 77503 9056818 13:16.2n __ 049:08.7e, gulf of aden four pirates armed with automatic guns and rocket launchers in a grey coloured, long speed boat approached the ship underway from the port quarter. they fired at the bridge and accommodation. master raised alarm, increased speed, took evasive manoeuvres and crew mustered. oow informed ships in vicinity via vhf ch. 16. the pirates tried to board the ship without success and finally aborted the attempt. one, white hull fishing boat, was noticed about six nm off.;1;0;458.481287881;98.9736414556;5.0;16.0;G;219.493452902
2008;24;5;;BCD;13:58N;050:42E;Product Tanker;Singapore;Steaming;Fired upon;-1;-1;;0;0;0;0;0;1;1420 LT Steaming Fired upon Taiyoh II Product Tanker Singapore 39268 9006746 13:58N __ 050:42E, Gulf of Aden Two boats with four armed pirates in each boat closed onto a tanker underway. The pirates opened fire with automatic guns and RPG.  One RPG hit and damaged the port bridge wing. Evasive manoeuvres prevented the pirates from boarding. No injuries to crew and no pollution. After breaking off, the two boats were reported to be drifting in the same vicinity.;13.9666666667;50.7;10.0;1420 lt steaming fired upon taiyoh ii product tanker singapore 39268 9006746 13:58n __ 050:42e, gulf of aden two boats with four armed pirates in each boat closed onto a tanker underway. the pirates opened fire with automatic guns and rpg.  one rpg hit and damaged the port bridge wing. evasive manoeuvres prevented the pirates from boarding. no injuries to crew and no pollution. after breaking off, the two boats were reported to be drifting in the same vicinity.;1;0;485.418231382;112.309694117;6.0;19.0;G;245.228748119
2008;25;5;;BCD;13:25.2N;047:57.8E;Bulk Carrier;Marshall Islands;Steaming;Attempted;-1;-1;;0;0;0;0;0;0;0610 LT Steaming Attempted Furtrans Bulk Bulk Carrier Marshall Islands 25312 9188908 13:25.2N __ 047:57.8E Gulf of Aden Three boats closed onto the ship underway.  There were four armed persons in each boat. The boats followed the ship at a distance of one cable and the armed men were heard shouting in a foreign language. Master raised alarm, all crew mustered and anti piracy measures enforced. After following the ship for 25 minutes, the boats aborted the attempt and moved away.;13.4172222222;47.9522222222;10.0;0610 lt steaming attempted furtrans bulk bulk carrier marshall islands 25312 9188908 13:25.2n __ 047:57.8e gulf of aden three boats closed onto the ship underway.  there were four armed persons in each boat. the boats followed the ship at a distance of one cable and the armed men were heard shouting in a foreign language. master raised alarm, all crew mustered and anti piracy measures enforced. after following the ship for 25 minutes, the boats aborted the attempt and moved away.;0;0;334.020267631;58.8308851881;5.0;14.0;G;270.497351316
2008;3;6;;BCD;12:43.8N;049:51.5E;Container;Taiwan;Steaming;Fired upon;2;2;;0;0;0;0;0;0;0705 UTC Steaming Fired upon YM Ocean Container Taiwan 29872 7810923 12:43.8N __ 049:51.5E, Gulf of Aden Two pirate boats opened fire on the ship underway. Two coalition warships in the vicinity, came to assist the ship. The pirates aborted the attack. All crew safe.;12.7188888889;49.8513888889;11.0;0705 utc steaming fired upon ym ocean container taiwan 29872 7810923 12:43.8n __ 049:51.5e, gulf of aden two pirate boats opened fire on the ship underway. two coalition warships in the vicinity, came to assist the ship. the pirates aborted the attack. all crew safe.;0;1;534.127215852;119.695893149;4.0;17.0;G;175.439162738
2008;21;6;;BCD;13:08.7N;048:03.7E;Refrigerated Cargo;Antigua & Barbuda;Steaming;Attempted;-1;-1;;0;0;0;0;0;0;0610 LT Steaming Attempted Hudson Bay Refrigerated Cargo Antigua & Barbuda 8052 8202654 13:08.7N __ 048:03.7E, Gulf of Aden Two wooden speed boats approached the ship. One boat crossed the ship_s bow whilst the other remained on the portside.  Not suspecting any pirate activity the master sailed between the two boats, which then closed in on the ship. One of the crafts was preparing ladder with hook in order to board. Ship raised the alarm and evasive manoeuvres adopted.  The two speed boats aborted their attack and moved away. The ship continued on her passage.;13.1352777778;48.0519444444;12.0;0610 lt steaming attempted hudson bay refrigerated cargo antigua & barbuda 8052 8202654 13:08.7n __ 048:03.7e, gulf of aden two wooden speed boats approached the ship. one boat crossed the ship_s bow whilst the other remained on the portside.  not suspecting any pirate activity the master sailed between the two boats, which then closed in on the ship. one of the crafts was preparing ladder with hook in order to board. ship raised the alarm and evasive manoeuvres adopted.  the two speed boats aborted their attack and moved away. the ship continued on her passage.;0;1;340.182714147;89.6044603654;4.0;14.0;G;238.084406831
2008;6;7;;BCD;12:34.3N;043:25.6E;Bulk Carrier;Liberia;Steaming;Attempted;-1;-1;;0;0;0;0;0;0;0945 LT Steaming Attempted  Shamrock Bulk Carrier Liberia 30046 9324667 12:34.3N __ 043:25.6E, Off Mayyun Island, Gulf of Aden Blue coloured wooden boats, with 10 __ 15 people attempted to close onto the ship underway.  Alarm raised. Crew implemented anti piracy measures.  After 10 minutes of trying to get closer to the ship, the boats aborted the attempt and moved away.;12.5675;43.4183333333;13.0;0945 lt steaming attempted  shamrock bulk carrier liberia 30046 9324667 12:34.3n __ 043:25.6e, off mayyun island, gulf of aden blue coloured wooden boats, with 10 __ 15 people attempted to close onto the ship underway.  alarm raised. crew implemented anti piracy measures.  after 10 minutes of trying to get closer to the ship, the boats aborted the attempt and moved away.;0;1;111.953164224;12.9446348416;4.0;6.0;G;642.066451093
2008;15;7;;BCD;13:31.0N;049:11.6E;Chemical Tanker;Panama;Steaming;Fired upon;-1;-1;;0;0;0;0;0;0;1030 UTC Steaming Fired upon Chemstar Moon Chemical Tanker Panama 11590 9255983    13:31.0N __ 049:11.6E, 44 NM Off Yemen, Gulf of Aden D/O onboard the tanker underway noticed about 10 - 12 pirates in two blue and white coloured speedboats at a distance of 2.5 NM. The speedboats suddenly approached the tanker and fired at her. D/O raised the alarm, sounded ship_s whistle and crew mustered. Pirates noticed crew alertness and reduced their speed and aborted the attempted boarding.;13.5166666667;49.185;14.0;1030 utc steaming fired upon chemstar moon chemical tanker panama 11590 9255983    13:31.0n __ 049:11.6e, 44 nm off yemen, gulf of aden d/o onboard the tanker underway noticed about 10 - 12 pirates in two blue and white coloured speedboats at a distance of 2.5 nm. the speedboats suddenly approached the tanker and fired at her. d/o raised the alarm, sounded ship_s whistle and crew mustered. pirates noticed crew alertness and reduced their speed and aborted the attempted boarding.;0;1;467.382981568;79.2424433908;5.0;16.0;G;247.071935969
2008;18;7;;BCD;12:47.5N;051:02.0E;Container;Panama;Steaming;Attempted;-1;-1;;0;0;0;0;0;0;0720 UTC Steaming Attempted MSC Rania Container Panama 94489 9309447 12:47.5N __ 051:02.0E, Gulf of Aden Heavily armed pirates, in two, six-meter long yellow craft, attempted to board the ship underway from the aft. Master took evasive manoeuvres, raised alarm and crew mustered with pressurised fire hoses. Upon seeing crew alertness, pirates aborted the attempt.;12.7847222222;51.0333333333;14.0;0720 utc steaming attempted msc rania container panama 94489 9309447 12:47.5n __ 051:02.0e, gulf of aden heavily armed pirates, in two, six-meter long yellow craft, attempted to board the ship underway from the aft. master took evasive manoeuvres, raised alarm and crew mustered with pressurised fire hoses. upon seeing crew alertness, pirates aborted the attempt.;0;1;561.631563309;92.1049214774;4.0;19.0;G;109.653731272
2008;8;8;;BCD;13:12N;049:56E;Bulk Carrier;Singapore;Steaming;Fired upon;7;7;;0;0;0;0;0;1;0345 UTC Steaming Fired upon Gem of Kilakarai Bulk Carrier Singapore 32474 9287962  13:12N __ 049:56E, Gulf of Aden Seven pirates, in two speedboats, armed with guns and rocket propelled grenade launchers chased and fired on the ship underway.  The master contacted the IMB Piracy Reporting Centre for assistance.  Duty officer at the Piracy Reporting Centre advised master to enforce anti piracy measures to prevent boarding of ship and informed him that the coalition navy and other relevant authorities would be contacted to render assistance to the ship.  The coalition navy dispatched one warship to assist the ship.  The constant manoeuvring of the ship prevented the boarding of the pirates. On seeing the coalition warship, the pirate boats aborted their attempt and moved away.  Ship resumed voyage.  All crew safe. No damage to ship.  An unexploded grenade was found on the bridge wing. Master and crew were advised not to go near the grenade. The coalition navy sent their teams who disposed the grenade.;13.2;49.9333333333;15.0;0345 utc steaming fired upon gem of kilakarai bulk carrier singapore 32474 9287962  13:12n __ 049:56e, gulf of aden seven pirates, in two speedboats, armed with guns and rocket propelled grenade launchers chased and fired on the ship underway.  the master contacted the imb piracy reporting centre for assistance.  duty officer at the piracy reporting centre advised master to enforce anti piracy measures to prevent boarding of ship and informed him that the coalition navy and other relevant authorities would be contacted to render assistance to the ship.  the coalition navy dispatched one warship to assist the ship.  the constant manoeuvring of the ship prevented the boarding of the pirates. on seeing the coalition warship, the pirate boats aborted their attempt and moved away.  ship resumed voyage.  all crew safe. no damage to ship.  an unexploded grenade was found on the bridge wing. master and crew were advised not to go near the grenade. the coalition navy sent their teams who disposed the grenade.;1;1;544.051150152;158.52902848;5.0;17.0;G;209.522469898
2008;23;8;;BCD;14:16N;050:19.40E;General Cargo;Panama;Steaming;Fired upon;-1;-1;;0;0;0;0;0;0;0908 UTC Steaming Fired upon Aizu General Cargo Panama 14103 8214607 14:16N __ 050:19.40E, Gulf of Aden Pirates, in two speedboats chased and fired upon the ship underway. Master raised alarm, increased speed, took evasive manoeuvres, activated anti-piracy measures and fired rocket flares. At 1020 UTC, when the IMB Piracy Reporting Centre contacted the master of the ship again he indicated that the pirates stopped firing and stopped chasing the ship. The master informed that the mother ship was about three NM away.;14.2666666667;50.3277777778;16.0;0908 utc steaming fired upon aizu general cargo panama 14103 8214607 14:16n __ 050:19.40e, gulf of aden pirates, in two speedboats chased and fired upon the ship underway. master raised alarm, increased speed, took evasive manoeuvres, activated anti-piracy measures and fired rocket flares. at 1020 utc, when the imb piracy reporting centre contacted the master of the ship again he indicated that the pirates stopped firing and stopped chasing the ship. the master informed that the mother ship was about three nm away.;0;1;494.593215409;65.9719516028;6.0;18.0;G;288.912082053
2008;23;8;;BCD;14:11.3N;050:20.3E;Bulk Carrier;Liberia;Steaming;Fired upon;-1;-1;;0;0;0;0;0;0;1220 UTC Steaming Fired upon St. Anna Bulk Carrier Liberia 31661 8623884 14:11.3N __ 050:20.3E, Gulf of Aden Pirates chased and fired upon the ship underway. Master contacted the IMB Piracy Reporting Centre for help. The centre informed the coalition and other agencies for immediate assistance. Military aircraft arrived and the pirates stopped the chase.;14.1841666667;50.3341666667;16.0;1220 utc steaming fired upon st. anna bulk carrier liberia 31661 8623884 14:11.3n __ 050:20.3e, gulf of aden pirates chased and fired upon the ship underway. master contacted the imb piracy reporting centre for help. the centre informed the coalition and other agencies for immediate assistance. military aircraft arrived and the pirates stopped the chase.;0;1;499.64488974;75.006329778;6.0;18.0;G;280.126027331
2008;3;9;;BCD;13:36.9N;049:12.2E;Bulk Carrier;Italy;Steaming;Fired upon;-1;-1;;0;0;0;0;0;0;1436 UTC Steaming Fired upon Orsolina Bottiglieri Bulk Carrier Italy 39713 9219434  13:36.9N __ 049:12.2E,  39 NM Off Yemeni Coast,  Gulf of Aden Two speedboats with five persons in each boat attempted to board the ship underway.  Master increased speed, took evasive manoeuvres and crew mustered. The pirates fired upon the ship and the master contacted the coalition warship. The boats aborted the attempt at 1450 UTC and moved away. A coalition warship arrived at location and escorted the ship.;13.6025;49.2005555556;17.0;1436 utc steaming fired upon orsolina bottiglieri bulk carrier italy 39713 9219434  13:36.9n __ 049:12.2e,  39 nm off yemeni coast,  gulf of aden two speedboats with five persons in each boat attempted to board the ship underway.  master increased speed, took evasive manoeuvres and crew mustered. the pirates fired upon the ship and the master contacted the coalition warship. the boats aborted the attempt at 1450 utc and moved away. a coalition warship arrived at location and escorted the ship.;0;1;470.626978844;73.3906118068;5.0;16.0;G;256.586544926
2008;5;9;;BCD;12:57.5N;047:04.0E;General Cargo;St. Vincent and Grenadines;Steaming;Fired upon;4;4;;0;0;0;0;0;1;0510 UTC Steaming Fired upon Jin Yuan Men General Cargo St. Vincent and Grenadines 14991 7609207 12:57.5N __ 047:04.0E, Gulf of Aden A general cargo ship underway, noticed a blue coloured tug suspected to be a pirate mother vessel, towing a small boat.  The small boat suddenly proceeded at high speed and approached the ship.  D/O raised alarm and crew mustered.  Four pirates, armed with RPG and automatic weapons were firing at the ship in an attempt to board the ship.  Master increased speed and took evasive manoeuvres.  Crew activated fire hoses and threw hard objects to hit the pirates.  Pirates kept on firing at the ship and at 0600 UTC, The pirates gave up the attempt and fled.;12.9513888889;47.0666666667;17.0;0510 utc steaming fired upon jin yuan men general cargo st. vincent and grenadines 14991 7609207 12:57.5n __ 047:04.0e, gulf of aden a general cargo ship underway, noticed a blue coloured tug suspected to be a pirate mother vessel, towing a small boat.  the small boat suddenly proceeded at high speed and approached the ship.  d/o raised alarm and crew mustered.  four pirates, armed with rpg and automatic weapons were firing at the ship in an attempt to board the ship.  master increased speed and took evasive manoeuvres.  crew activated fire hoses and threw hard objects to hit the pirates.  pirates kept on firing at the ship and at 0600 utc, the pirates gave up the attempt and fled.;1;1;232.01960671;64.1073415877;4.0;12.0;G;293.771228978
2008;6;9;;BCD;12:57.8N;047:01.6E;LPG Tanker;Singapore;Steaming;Attempted;4;6;;0;0;0;0;0;1;0705 UTC Steaming Attempted Sigloo Discovery LPG Tanker Singapore 7954 8511964 12:57.8N __ 047:01.6E,  33 NM South of Yemeni Coast,  Gulf of Aden About six pirates armed with RPG in a white speedboat approached the tanker underway.  Alarm raised, foghorn sounded, crew mustered and Chief officer directed fire hose towards the boat.  The pirates signalled to reduce speed and pointed RPG at the Chief officer, who dropped the fire hose and entered the accommodation.  Master increased ship speed to maximum and took evasive manoeuvres by giving large helm orders. This resulted in the speedboat rolling heavily, causing four pirates to fall overboard.  The speedboat recovered the pirates and resumed chasing the tanker again.  Mayday broadcast made and SSAS activated.  UKMTO Dubai and IMB Piracy Reporting Centre informed.  The Centre immediately informed the Coalition Forces.  The speedboat came close to the tanker, but later gave up the chase and met up with a pirate mother vessel that was a raft with an orange cover.  A passing ship informed that coalition warships were proceeding for assistance and were calling the tanker on VHF.;12.9522222222;47.0183333333;17.0;0705 utc steaming attempted sigloo discovery lpg tanker singapore 7954 8511964 12:57.8n __ 047:01.6e,  33 nm south of yemeni coast,  gulf of aden about six pirates armed with rpg in a white speedboat approached the tanker underway.  alarm raised, foghorn sounded, crew mustered and chief officer directed fire hose towards the boat.  the pirates signalled to reduce speed and pointed rpg at the chief officer, who dropped the fire hose and entered the accommodation.  master increased ship speed to maximum and took evasive manoeuvres by giving large helm orders. this resulted in the speedboat rolling heavily, causing four pirates to fall overboard.  the speedboat recovered the pirates and resumed chasing the tanker again.  mayday broadcast made and ssas activated.  ukmto dubai and imb piracy reporting centre informed.  the centre immediately informed the coalition forces.  the speedboat came close to the tanker, but later gave up the chase and met up with a pirate mother vessel that was a raft with an orange cover.  a passing ship informed that coalition warships were proceeding for assistance and were calling the tanker on vhf.;0;1;226.790586591;61.9396874819;4.0;12.0;G;297.940093965
