2009;21;2;;BCD;14:31.1N;053:43.1E;General Cargo;Cyprus;Steaming;Attempted;-1;-1;;0;0;0;0;0;0;1900 UTC Steaming Attempted Bahia General Cargo Cyprus 9077 7705568 14:31.1N __ 053:43.1E, Gulf of Aden Pirates in an unlit high-speedboat chased the ship underway. The boat came close to the ship and attempted to board. Master raised alarm, increased speed, took evasive manoeuvres, crew switched on additional lighting and activated fire hoses. The pirates aborted the attempt due to the evasive manoeuvres taken by the ship.;14.5169444444;53.7169444444;4.0;1900 utc steaming attempted bahia general cargo cyprus 9077 7705568 14:31.1n __ 053:43.1e, gulf of aden pirates in an unlit high-speedboat chased the ship underway. the boat came close to the ship and attempted to board. master raised alarm, increased speed, took evasive manoeuvres, crew switched on additional lighting and activated fire hoses. the pirates aborted the attempt due to the evasive manoeuvres taken by the ship.;0;0;271.141663435;200.398947961;7.0;24.0;G;400.943232447
2009;24;2;;BCD;13:52N;049:42E;Product Tanker;Liberia;Steaming;Attempted;-1;-1;;0;0;0;0;0;0;1235 UTC Steaming Attempted Lia Product Tanker Liberia 42010 9417751 13:52N __ 049:42E, Gulf of Aden A tanker underway detected on radar, pirates in two high speed crafts approaching. Master raised alarm, crew mustered and activated fire hoses. Master requested for naval warship assistance and a Chinese warship acknowledged and dispatched a helicopter. The tanker increased speed and took evasive manoeuvres. The naval helicopter positioned itself over the pirate craft resulting in the pirates aborting the attack.;13.8666666667;49.7;4.0;1235 utc steaming attempted lia product tanker liberia 42010 9417751 13:52n __ 049:42e, gulf of aden a tanker underway detected on radar, pirates in two high speed crafts approaching. master raised alarm, crew mustered and activated fire hoses. master requested for naval warship assistance and a chinese warship acknowledged and dispatched a helicopter. the tanker increased speed and took evasive manoeuvres. the naval helicopter positioned itself over the pirate craft resulting in the pirates aborting the attack.;0;0;529.282879195;91.3693578171;6.0;17.0;G;282.383884925
2009;25;2;;BCD;13:08.4N;049:09.5E;Bulk Carrier;China;Steaming;Fired upon;4;4;;0;0;0;0;0;1;1030 UTC Steaming Fired upon Yan Dang Hai Bulk Carrier China 32474 9488229 13:08.4N __ 049:09.5E, Gulf of Aden Four pirates in a speedboat armed with rocket launcher fired upon the ship underway. Master raised alarm, sent distress message and took evasive manoeuvres.  Crew activated fire hoses and threw empty bottles. Pirates aborted the attempted attack.;13.1344444444;49.1513888889;4.0;1030 utc steaming fired upon yan dang hai bulk carrier china 32474 9488229 13:08.4n __ 049:09.5e, gulf of aden four pirates in a speedboat armed with rocket launcher fired upon the ship underway. master raised alarm, sent distress message and took evasive manoeuvres.  crew activated fire hoses and threw empty bottles. pirates aborted the attempted attack.;0;0;458.981947285;112.824337055;4.0;16.0;G;204.784140056
2009;26;2;;BCD;12:11N;043:31E;Bulk Carrier;Panama;Steaming;Attempted;-1;-1;;0;0;0;0;0;0;0600 UTC Steaming Attempted Diana C Bulk Carrier Panama 21968 8025317 12:11N __ 043:31E, Straits of Bab El Mandeb, Red Sea A group of armed pirates in three high speedboats approached and attempted to attack the ship underway.  Master raised alarm and took evasive manoeuvres.  Pirates aborted the attempted attack due to the evasive manoeuvres taken by the ship.;12.1833333333;43.5166666667;4.0;0600 utc steaming attempted diana c bulk carrier panama 21968 8025317 12:11n __ 043:31e, straits of bab el mandeb, red sea a group of armed pirates in three high speedboats approached and attempted to attack the ship underway.  master raised alarm and took evasive manoeuvres.  pirates aborted the attempted attack due to the evasive manoeuvres taken by the ship.;0;0;77.8657242264;11.388014807;3.0;6.0;G;623.875696243
2009;2;3;;BCD;12:09N;045:33E;Tanker;Panama;Steaming;Fired upon;-1;-1;;0;0;0;0;0;0;0649 UTC Steaming Fired upon Pro Alliance Tanker Panama 57773 9404936 12:09N __ 045:33E, Gulf of Aden Pirates armed with guns fired upon the tanker underway. Master reported to coalition warship and increased speed, took evasive manoeuvres and altered away from the pirate boats. Later, pirates aborted the attempted attack. All crew safe.;12.15;45.55;5.0;0649 utc steaming fired upon pro alliance tanker panama 57773 9404936 12:09n __ 045:33e, gulf of aden pirates armed with guns fired upon the tanker underway. master reported to coalition warship and increased speed, took evasive manoeuvres and altered away from the pirate boats. later, pirates aborted the attempted attack. all crew safe.;1;0;99.6632268054;86.4485001168;3.0;10.0;G;405.752973455
2009;3;3;;BCD;13:02N;048:43E;Container;Antigua and Barbuda;Steaming;Fired upon;-1;-1;;0;0;0;0;0;1;0612 UTC Steaming Fired upon Courier Container Antigua and Barbuda 14860 9101481 13:02N __ 048:43E, Gulf of Aden Pirates armed with RPG and rifles fired upon and attempted to board the ship underway. Master raised alarm, sent distress message and took evasive manoeuvres. A naval warship responded to the distress call and sent a helicopter. The helicopter fired warning shots and the pirates aborted the attempted attack.;13.0333333333;48.7166666667;5.0;0612 utc steaming fired upon courier container antigua and barbuda 14860 9101481 13:02n __ 048:43e, gulf of aden pirates armed with rpg and rifles fired upon and attempted to board the ship underway. master raised alarm, sent distress message and took evasive manoeuvres. a naval warship responded to the distress call and sent a helicopter. the helicopter fired warning shots and the pirates aborted the attempted attack.;1;0;411.25200868;110.205956797;4.0;15.0;G;199.690221429
2009;4;3;;BCD;12:17.9N;044:09.9E;Bulk Carrier;Malta;Steaming;Attempted;-1;-1;;0;0;0;0;0;0;0735 UTC Steaming Attempted Consul Poppe Bulk Carrier Malta 36074 9110212 12:17.9N __ 044:09.9E, Gulf of Aden Five armed pirates in a boat approached the ship underway. Master raised alarm, increased speed, took evasive manoeuvres and fired rocket flares. Finally, the boat aborted the attempted attack and passed on the ship_s port beam at a distance of 0.4 NM.;12.2858333333;44.1525;5.0;0735 utc steaming attempted consul poppe bulk carrier malta 36074 9110212 12:17.9n __ 044:09.9e, gulf of aden five armed pirates in a boat approached the ship underway. master raised alarm, increased speed, took evasive manoeuvres and fired rocket flares. finally, the boat aborted the attempted attack and passed on the ship_s port beam at a distance of 0.4 nm.;0;0;103.195869971;36.6370915559;3.0;7.0;G;557.609520927
2009;11;3;;BCD;13:16.5N;049:44.3E;Bulk Carrier;Marshall Islands;Steaming;Attempted;-1;-1;;0;0;0;0;0;0;0520 UTC Steaming Attempted Atalanta Bulk Carrier Marshall Islands 19882 9228394 13:16.5N __ 049:44.3E, 88 NM Off Al Mukalla, Gulf of Aden  While underway, the ship spotted a boat drifting about five miles on her stbd beam.  When the ship was about 1.7 miles from the boat, the boat headed towards her.  Master took evasive manoeuvres, contacted warship and informed company CSO. After a while the boat aborted the attempt. Two warships arrived at the location and a helicopter hovered above the ship and headed towards the boat.  The ship continued her passage. Description of boat: white hull with one wooded mast in the centre. Boat had five/six people standing in the boat.;13.2680555556;49.7341666667;5.0;0520 utc steaming attempted atalanta bulk carrier marshall islands 19882 9228394 13:16.5n __ 049:44.3e, 88 nm off al mukalla, gulf of aden  while underway, the ship spotted a boat drifting about five miles on her stbd beam.  when the ship was about 1.7 miles from the boat, the boat headed towards her.  master took evasive manoeuvres, contacted warship and informed company cso. after a while the boat aborted the attempt. two warships arrived at the location and a helicopter hovered above the ship and headed towards the boat.  the ship continued her passage. description of boat: white hull with one wooded mast in the centre. boat had five/six people standing in the boat.;0;0;523.108488495;139.536189088;5.0;17.0;G;228.073297279
2009;14;3;;BCD;13:40.5N;049:17.5E;Bulk Carrier;Vietnam;Steaming;Fired upon;-1;-1;;0;0;0;0;0;0;0615 UTC Steaming Fired upon Diamond Falcon Bulk Carrier Vietnam 14851 9482811 13:40.5N __ 049:17.5E, 47 NM Off Al Mukalla, Gulf of Aden Armed pirates in speedboats fired upon the ship underway.  Master contacted IMB Piracy Reporting Centre who immediately notified the coalition forces.  Two helicopters from the coalition warships arrived at the scene in next few minutes.  Seeing the helicopters the pirates moved away.  The ship increased speed and successfully avoided the boarding and moved away. No injuries to crew. Ship sustained many bullet holes.;13.6680555556;49.2847222222;5.0;0615 utc steaming fired upon diamond falcon bulk carrier vietnam 14851 9482811 13:40.5n __ 049:17.5e, 47 nm off al mukalla, gulf of aden armed pirates in speedboats fired upon the ship underway.  master contacted imb piracy reporting centre who immediately notified the coalition forces.  two helicopters from the coalition warships arrived at the scene in next few minutes.  seeing the helicopters the pirates moved away.  the ship increased speed and successfully avoided the boarding and moved away. no injuries to crew. ship sustained many bullet holes.;0;0;480.900681398;73.9436576908;5.0;16.0;G;264.12481798
2009;16;3;;BCD;12:33.4N;043:25.5E;Bulk Carrier;Panama;Steaming;Attempted;-1;-1;;0;0;0;0;0;0;1505 UTC Steaming Attempted Northern Star Bulk Carrier Panama 18596 8208957 12:33.4N __ 043:25.5E, Straits of Bab El Mandeb, Red Sea Pirates in two speedboats armed with machine guns chased the ship underway. The speedboats crossed the ship_s bow and came onto the port side.  Master took evasive manoeuvres and prevented the boarding.;12.5511111111;43.4180555556;6.0;1505 utc steaming attempted northern star bulk carrier panama 18596 8208957 12:33.4n __ 043:25.5e, straits of bab el mandeb, red sea pirates in two speedboats armed with machine guns chased the ship underway. the speedboats crossed the ship_s bow and came onto the port side.  master took evasive manoeuvres and prevented the boarding.;1;0;110.212457833;13.1244256088;4.0;6.0;G;641.715991839
2009;20;3;;BCD;13:42.6N;042:27.8E;Chemical Tanker;Italy;Steaming;Attempted;-1;-1;;0;0;0;0;0;0;0600 UTC Steaming Attempted Valle Di Aragona Chemical Tanker Italy 25063 9220914 13:42.6N __  042:27.8E, Southern Red Sea Pirates armed with machine guns in two speedboats chased the tanker underway. Speedboats crossed the tankers bow and came onto the port side. Master took evasive manoeuvres and activated fire hoses. Pirates aborted the attempt.;13.7016666667;42.4522222222;6.0;0600 utc steaming attempted valle di aragona chemical tanker italy 25063 9220914 13:42.6n __  042:27.8e, southern red sea pirates armed with machine guns in two speedboats chased the tanker underway. speedboats crossed the tankers bow and came onto the port side. master took evasive manoeuvres and activated fire hoses. pirates aborted the attempt.;1;0;135.545488006;23.3505296958;5.0;4.0;G;777.276876432
2009;20;3;;BCD;13:10N;049:13E;Product Tanker;Liberia;Steaming;Attempted;5;5;;0;0;0;0;0;0;0530 LT Steaming Attempted Iasonas Product Tanker Liberia 62782 9419357 13:10N __ 049:13E, Gulf of Aden A speedboat with five pirates attempted to board the tanker underway using long poles and hooks. Alert crew raised alarm.  Master increased speed and carried out evasive manoeuvres.  Master informed coalition warships and a helicopter flew over the ship.  The pirates aborted the attempt and moved away.;13.1666666667;49.2166666667;6.0;0530 lt steaming attempted iasonas product tanker liberia 62782 9419357 13:10n __ 049:13e, gulf of aden a speedboat with five pirates attempted to board the tanker underway using long poles and hooks. alert crew raised alarm.  master increased speed and carried out evasive manoeuvres.  master informed coalition warships and a helicopter flew over the ship.  the pirates aborted the attempt and moved away.;0;0;466.296002607;112.996595694;4.0;16.0;G;208.413211134
2009;25;3;;BCD;13:31N;042:34E;Bulk Carrier;Hong Kong;Steaming;Attempted;-1;-1;;0;0;0;0;0;0;1210 UTC Steaming Attempted Mount Adams Bulk Carrier Hong Kong 17431 9245067 13:31N __  042: 34E Southern Red Sea A bulk carrier was attacked by pirates in speedboats. The ship adopted evasive manoeuvres and avoided the attempt by employing effective anti piracy measures.;13.5166666667;42.5666666667;6.0;1210 utc steaming attempted mount adams bulk carrier hong kong 17431 9245067 13:31n __  042: 34e southern red sea a bulk carrier was attacked by pirates in speedboats. the ship adopted evasive manoeuvres and avoided the attempt by employing effective anti piracy measures.;0;0;150.958714007;25.7797099141;5.0;4.0;G;758.949934343
2009;26;3;;BCD;12:38N;043:18E;Chemical Tanker;Bahamas;Steaming;Attempted;-1;-1;;0;0;0;0;0;0;1528 UTC Steaming Attempted Hugli Spirit Chemical Tanker Bahamas 29242 9283784 12:38N __ 043:18E, Straits of Bab El Mandeb, Red Sea While underway the tanker spotted two speedboats (white hull) with five persons in each boat. The tanker enforced anti piracy measures and made evasive manoeuvres.  Later the speedboats aborted the attempt.;12.6333333333;43.3;6.0;1528 utc steaming attempted hugli spirit chemical tanker bahamas 29242 9283784 12:38n __ 043:18e, straits of bab el mandeb, red sea while underway the tanker spotted two speedboats (white hull) with five persons in each boat. the tanker enforced anti piracy measures and made evasive manoeuvres.  later the speedboats aborted the attempt.;0;0;116.039632616;11.6361693117;4.0;5.0;G;656.184725339
2009;28;3;;BCD;12:26N;046:53E;Yacht;Unknown;Steaming;Fired upon;-1;-1;;0;0;0;0;0;0;1150 UTC Steaming Fired upon Grandezza Yacht Unknown- - 12:26N __ 046:53E, Gulf of Aden Pirates in skiffs armed with guns chased and fired upon the yacht underway. Master contacted coalition warships for help.  Pirates attempted to board using a ladder but fell into the sea.  A coalition helicopter arrived at location. Upon seeing the helicopter, the pirates aborted the attempt and escaped.;12.4333333333;46.8833333333;6.0;1150 utc steaming fired upon grandezza yacht unknown- - 12:26n __ 046:53e, gulf of aden pirates in skiffs armed with guns chased and fired upon the yacht underway. master contacted coalition warships for help.  pirates attempted to board using a ladder but fell into the sea.  a coalition helicopter arrived at location. upon seeing the helicopter, the pirates aborted the attempt and escaped.;1;0;216.060043439;111.895417433;3.0;12.0;G;279.423249691
2009;29;3;;BCD;11:50.2N;044:53.3E;Chemical Tanker;Singapore;Steaming;Attempted;-1;-1;;0;0;0;0;0;0;2123 LT Steaming Attempted Siteam Leader Chemical Tanker Singapore 26751 9343194 11:50.2N -  044:53.3E, Gulf of Aden Pirates in a speedboat approached and attempted to board the tanker underway by using metal hooks and ropes.  Alert crew prevented the boarding and informed duty officer on bridge.  The tanker made evasive manoeuvres and escaped from the pirate attack.;11.8338888889;44.8841666667;6.0;2123 lt steaming attempted siteam leader chemical tanker singapore 26751 9343194 11:50.2n -  044:53.3e, gulf of aden pirates in a speedboat approached and attempted to board the tanker underway by using metal hooks and ropes.  alert crew prevented the boarding and informed duty officer on bridge.  the tanker made evasive manoeuvres and escaped from the pirate attack.;0;0;108.85115323;98.4572546178;2.0;8.0;G;471.067664188
2009;2;4;;BCD;13:51.1N;051:14.2E;Bulk Carrier;Marshall Islands;Steaming;Attempted;-1;-1;;0;0;0;0;0;0;1300 UTC Steaming Attempted Grain Express Bulk Carrier Marshall Islands 39974 9284910 13:51.1N __ 051:14.2E, 94 NM SSW of Ras Sharwayn, Gulf of Aden Two speedboats, blue and white in colour, with 3 - 4 persons onboard approached the ship underway at over 20 knots.  The speedboats came as close as 0.40 NM. Master sounded the general alarm and whistle. An Indian warship was informed.  Two helicopters from Japan and India responded and the pirates aborted their attempt on sighting the helicopters.;13.8502777778;51.2338888889;7.0;1300 utc steaming attempted grain express bulk carrier marshall islands 39974 9284910 13:51.1n __ 051:14.2e, 94 nm ssw of ras sharwayn, gulf of aden two speedboats, blue and white in colour, with 3 - 4 persons onboard approached the ship underway at over 20 knots.  the speedboats came as close as 0.40 nm. master sounded the general alarm and whistle. an indian warship was informed.  two helicopters from japan and india responded and the pirates aborted their attempt on sighting the helicopters.;0;0;454.811201678;144.264357098;6.0;20.0;G;224.983531407
2009;9;4;;BCD;13:07.7N;049:09.3E;Bulk Carrier;Marshall Islands;Steaming;Fired upon;-1;-1;;0;0;0;0;0;0;0001 UTC Steaming Fired upon Calm Seas Bulk Carrier Marshall Islands 38468 9184835 13:07.7N __ 049:09.3E,  Gulf of Aden Pirates in a skiff chased and fired upon the ship underway. The ship commenced evasive manoeuvres and contacted the coalition naval forces for assistance. A military helicopter arrived and upon sighting the aircraft, the pirates aborted the attempt.;13.1186111111;49.1508333333;7.0;0001 utc steaming fired upon calm seas bulk carrier marshall islands 38468 9184835 13:07.7n __ 049:09.3e,  gulf of aden pirates in a skiff chased and fired upon the ship underway. the ship commenced evasive manoeuvres and contacted the coalition naval forces for assistance. a military helicopter arrived and upon sighting the aircraft, the pirates aborted the attempt.;0;0;458.805493204;114.375611227;4.0;16.0;G;203.03303622
2009;9;4;;BCD;14:08N;051:29E;General Cargo;North Korea;Steaming;Fired upon;-1;-1;;0;0;0;0;0;1;1807 LT Steaming Fired upon Ryu Gyong General Cargo North Korea 9013 7433294 14:08N __ 051:29E, Gulf of Aden A general cargo ship underway sighted a suspicious mother vessel which later launched two skiffs.  The boats chased the ship and opened fire with guns and RPG. Master raised alarm, carried out evasive manoeuvers and succeeded in deterring the pirates.;14.1333333333;51.4833333333;7.0;1807 lt steaming fired upon ryu gyong general cargo north korea 9013 7433294 14:08n __ 051:29e, gulf of aden a general cargo ship underway sighted a suspicious mother vessel which later launched two skiffs.  the boats chased the ship and opened fire with guns and rpg. master raised alarm, carried out evasive manoeuvers and succeeded in deterring the pirates.;1;0;413.495012932;120.485067519;6.0;20.0;G;257.540836353
2009;11;4;;BCD;12:16.0N;046:23.6E;Bulk Carrier;Panama;Steaming;Fired upon;8;8;;0;0;0;0;0;0;0415 UTC Steaming Fired upon Anatolia Bulk Carrier Panama 16250 7433103 12:16.0N __ 046:23.6E, Gulf of Aden Eight pirates armed with guns in a speedboat (blue colour, plastic hull, 12m length) attacked and fired upon the ship underway. Ship took evasive manoeuvres and contacted coalition warship. A coalition warship acknowledged and came to the location. The pirates approached at a distance of 100m and aborted the attack.;12.2666666667;46.385;7.0;0415 utc steaming fired upon anatolia bulk carrier panama 16250 7433103 12:16.0n __ 046:23.6e, gulf of aden eight pirates armed with guns in a speedboat (blue colour, plastic hull, 12m length) attacked and fired upon the ship underway. ship took evasive manoeuvres and contacted coalition warship. a coalition warship acknowledged and came to the location. the pirates approached at a distance of 100m and aborted the attack.;1;0;169.092973444;126.444044221;3.0;11.0;G;322.097974945
2009;12;4;;BCD;13:03N;048:49E;Bulk Carrier;Malta;Steaming;Fired upon;6;6;;0;0;0;0;0;0;0400 UTC Steaming Fired upon Panamax Anna Bulk Carrier Malta 37519 8202678 13:03N __ 048:49E Gulf of Aden Six pirates armed with guns in a skiff fired upon the ship underway. Master sent distress messages and took evasive manoeuvres and prevented the boarding. The ship sustained slight damage to the bridge.;13.05;48.8166666667;7.0;0400 utc steaming fired upon panamax anna bulk carrier malta 37519 8202678 13:03n __ 048:49e gulf of aden six pirates armed with guns in a skiff fired upon the ship underway. master sent distress messages and took evasive manoeuvres and prevented the boarding. the ship sustained slight damage to the bridge.;1;0;422.180165343;110.981034494;4.0;15.0;G;199.112562304
2009;17;4;;BCD;12:51N;047:49E;General Cargo;Denmark;Steaming;Attempted;-1;-1;;0;0;0;0;0;0;0500 UTC Steaming Attempted Puma General Cargo Denmark 1398 9078048 12:51N __ 047:49E, Gulf of Aden A general cargo ship detected a speedboat approaching her at distance of 7NM. Warship contacted and informed of the speedboat and mother vessel nearby.  The speedboat doing a speed of 15 knots approached the ship on the stbd side. When the speedboat was about two NM, three armed pirates were sighted. Ship raised alarm, activated fire hoses and fired rocket flares. The speedboat came as close as 40-50 meters from the ship. Master fired rocket flares towards the speedboat and the pirates aborted the attempt and returned to the mother vessel.;12.85;47.8166666667;8.0;0500 utc steaming attempted puma general cargo denmark 1398 9078048 12:51n __ 047:49e, gulf of aden a general cargo ship detected a speedboat approaching her at distance of 7nm. warship contacted and informed of the speedboat and mother vessel nearby.  the speedboat doing a speed of 15 knots approached the ship on the stbd side. when the speedboat was about two nm, three armed pirates were sighted. ship raised alarm, activated fire hoses and fired rocket flares. the speedboat came as close as 40-50 meters from the ship. master fired rocket flares towards the speedboat and the pirates aborted the attempt and returned to the mother vessel.;0;0;313.025212958;100.12543555;4.0;14.0;G;227.240661071
2009;18;4;;BCD;12:14N;045:45E;Chemical Tanker;Marshall Islands;Steaming;Fired upon;-1;-1;;0;0;0;0;0;1;0745 UTC Steaming Fired upon Handytankers Magic Chemical Tanker Marshall Islands 24066 9420253 12:14N __ 045:45E, Gulf of Aden A tanker underway spotted a black hull vessel with length about 20M with black sail. Once the vessel was astern, it launched a white hull skiff which proceeded towards the tanker. Pirates in the skiff prepared a ladder to board the tanker. The tanker increased speed, took evasive manoeuvres and enforced anti piracy preventive measures.  Pirates fired RPG which fell on the deck of the tanker but did not explode.  Then, the pirates aborted the attack and returned to their mother vessel.;12.2333333333;45.75;8.0;0745 utc steaming fired upon handytankers magic chemical tanker marshall islands 24066 9420253 12:14n __ 045:45e, gulf of aden a tanker underway spotted a black hull vessel with length about 20m with black sail. once the vessel was astern, it launched a white hull skiff which proceeded towards the tanker. pirates in the skiff prepared a ladder to board the tanker. the tanker increased speed, took evasive manoeuvres and enforced anti piracy preventive measures.  pirates fired rpg which fell on the deck of the tanker but did not explode.  then, the pirates aborted the attack and returned to their mother vessel.;0;0;109.740099775;95.5251458457;3.0;10.0;G;386.948784518
2009;18;4;;BCD;12:18.3N;046:29.7E;Tanker;Norway;Steaming;Attempted;-1;-1;;0;0;0;0;0;0;1230 UTC Steaming Attempted Front Ardenne Tanker Norway 79633 9150834 12:18.3N __ 046:29.7E, Gulf of Aden Pirates armed with automatic weapons in a blue hulled skiff approached the tanker underway. Master increased speed, activated fire hoses, made evasive manoeuvres and contacted the coalition warships for help.  The pirates aborted the attempt.;12.3008333333;46.4852777778;8.0;1230 utc steaming attempted front ardenne tanker norway 79633 9150834 12:18.3n __ 046:29.7e, gulf of aden pirates armed with automatic weapons in a blue hulled skiff approached the tanker underway. master increased speed, activated fire hoses, made evasive manoeuvres and contacted the coalition warships for help.  the pirates aborted the attempt.;1;0;178.046478134;122.551910707;3.0;11.0;G;313.154089612
2009;20;4;;BCD;13:14.9N;047:40.9E;Bulk Carrier;Malta;Steaming;Fired upon;12;12;;0;0;0;0;0;0;0520 UTC Steaming Fired upon Atlantica Bulk Carrier Malta 28693 9216509 13:14.9N __ 047:40.9E, Gulf of Aden Twelve pirates, in two white coloured speedboats armed with automatic weapons, chased and fired upon the ship underway. Ship made evasive manoeuvres and enforced anti piracy measures and prevented the boarding.;13.2358333333;47.6691666667;8.0;0520 utc steaming fired upon atlantica bulk carrier malta 28693 9216509 13:14.9n __ 047:40.9e, gulf of aden twelve pirates, in two white coloured speedboats armed with automatic weapons, chased and fired upon the ship underway. ship made evasive manoeuvres and enforced anti piracy measures and prevented the boarding.;1;0;300.364081709;55.1199565695;5.0;13.0;G;270.545311649
